{
  "customerId": "01K5T0Q8C4000000000000K001",
  "saleId": "01K5VB000000000SR001000484",
  "dueAt": "2026-09-26T12:41:12Z",
  "note": "Pays when her wages come in",
  "userId": "01K5T0Q8C4000000000000A001",
  "replacedAt": null,
  "reminderSentAt": null,
  "reminderChannel": "none",
  "reminderAttempts": 0,
  "lastReminderAt": null,
  "lastReminderError": "",
  "reminderSetupKey": "",
  "isCurrent": true,
  "lastTryFailed": false,
  "branchId": "01K5T0Q8C4000000000000B001",
  "id": "01K5VB0000000000000PD00031",
  "companyId": "01K5T0Q8C4000000000000C001",
  "createdAt": "2026-09-23T09:44:12Z",
  "updatedAt": "2026-09-23T09:44:12Z",
  "rowVersion": 1,
  "deletedAt": null,
  "isDeleted": false,
  "domainEvents": []
}
